{
  "$schema":"https://json-schema.org/draft/2020-12/schema","$id":"https://coh.invalid/contracts/sentinel-discovery/v1/sentinel-config.schema.json","title":"COH Sentinel discovery configuration","type":"object","additionalProperties":false,
  "required":["schema_version","contract_version","source_id","adapter_version","deployment","endpoint","api_version","token_audience","tenant_id","workspace_id","workspace_resource_id","expected_region","credential_reference","tls_root_digest","transport_identity_digest","resources","fields","hard_limits","maximum_metadata_bytes","maximum_metadata_tables","maximum_metadata_columns","maximum_schema_entries_per_page","qualification_lifetime_seconds"],
  "properties":{"schema_version":{"const":"coh.sentinel-discovery-config/v1"},"contract_version":{"const":"1.0.0"},"source_id":{"$ref":"#/$defs/token"},"adapter_version":{"$ref":"#/$defs/token"},"deployment":{"const":"azure_public"},"endpoint":{"const":"https://api.loganalytics.azure.com"},"api_version":{"const":"v1"},"token_audience":{"const":"https://api.loganalytics.io/.default"},"tenant_id":{"$ref":"#/$defs/uuid"},"workspace_id":{"$ref":"#/$defs/uuid"},"workspace_resource_id":{"type":"string","minLength":80,"maxLength":512},"expected_region":{"$ref":"#/$defs/token"},"credential_reference":{"$ref":"#/$defs/token"},"tls_root_digest":{"$ref":"#/$defs/digest"},"transport_identity_digest":{"$ref":"#/$defs/digest"},"resources":{"type":"array","minItems":1,"maxItems":256,"items":{"$ref":"#/$defs/resource"}},"fields":{"type":"array","minItems":1,"maxItems":4096,"items":{"$ref":"#/$defs/field"}},"hard_limits":{"$ref":"#/$defs/limits"},"maximum_metadata_bytes":{"type":"integer","minimum":1024,"maximum":1048576},"maximum_metadata_tables":{"type":"integer","minimum":1,"maximum":10000},"maximum_metadata_columns":{"type":"integer","minimum":1,"maximum":100000},"maximum_schema_entries_per_page":{"type":"integer","minimum":1,"maximum":4096},"qualification_lifetime_seconds":{"type":"integer","minimum":1,"maximum":3600}},
  "$defs":{"token":{"type":"string","pattern":"^[a-z][a-z0-9_.-]{0,127}$"},"vendor":{"type":"string","pattern":"^[A-Za-z][A-Za-z0-9_]{0,127}$"},"digest":{"type":"string","pattern":"^sha256:[0-9a-f]{64}$"},"uuid":{"type":"string","pattern":"^[0-9a-f]{8}-[0-9a-f]{4}-[0-9a-f]{4}-[0-9a-f]{4}-[0-9a-f]{12}$"},"resource":{"type":"object","additionalProperties":false,"required":["id","table","timespan_column"],"properties":{"id":{"$ref":"#/$defs/token"},"table":{"$ref":"#/$defs/vendor"},"timespan_column":{"$ref":"#/$defs/vendor"}}},"field":{"type":"object","additionalProperties":false,"required":["vendor_name","schema_name","type","nullable","resource_ids"],"properties":{"vendor_name":{"$ref":"#/$defs/vendor"},"schema_name":{"$ref":"#/$defs/token"},"type":{"enum":["boolean","bytes","integer","ip","number","string","timestamp"]},"nullable":{"type":"boolean"},"resource_ids":{"type":"array","minItems":1,"maxItems":256,"uniqueItems":true,"items":{"$ref":"#/$defs/token"}}}},"limits":{"type":"object","additionalProperties":false,"required":["maximum_rows","maximum_bytes","maximum_duration_millis","maximum_pages","maximum_slices","maximum_cost_millionths","requests_per_minute"],"properties":{"maximum_rows":{"type":"integer","minimum":1,"maximum":100000},"maximum_bytes":{"type":"integer","minimum":1,"maximum":1048576},"maximum_duration_millis":{"type":"integer","minimum":1,"maximum":120000},"maximum_pages":{"type":"integer","minimum":1,"maximum":1000},"maximum_slices":{"type":"integer","minimum":1,"maximum":1000},"maximum_cost_millionths":{"type":"integer","minimum":1},"requests_per_minute":{"type":"integer","minimum":1,"maximum":1000}}}}
}
