{
  "schema_version":"coh.sentinel-discovery-config/v1","contract_version":"1.0.0","source_id":"sentinel-prod","adapter_version":"sentinel-1.0.0","deployment":"azure_public","endpoint":"https://api.loganalytics.azure.com","api_version":"v1","token_audience":"https://api.loganalytics.io/.default",
  "tenant_id":"11111111-1111-1111-1111-111111111111","workspace_id":"22222222-2222-2222-2222-222222222222","workspace_resource_id":"/subscriptions/33333333-3333-3333-3333-333333333333/resourceGroups/coh-security/providers/Microsoft.OperationalInsights/workspaces/coh-sentinel","expected_region":"westus2","credential_reference":"sentinel-reader","tls_root_digest":"sha256:1111111111111111111111111111111111111111111111111111111111111111","transport_identity_digest":"sha256:2222222222222222222222222222222222222222222222222222222222222222",
  "resources":[{"id":"security-events","table":"AzureActivity","timespan_column":"TimeGenerated"},{"id":"signin-events","table":"SigninLogs","timespan_column":"TimeGenerated"}],
  "fields":[{"vendor_name":"Category","schema_name":"event.action","type":"string","nullable":false,"resource_ids":["security-events"]},{"vendor_name":"TimeGenerated","schema_name":"event.time","type":"timestamp","nullable":false,"resource_ids":["security-events","signin-events"]},{"vendor_name":"IpAddress","schema_name":"source.ip","type":"ip","nullable":true,"resource_ids":["signin-events"]}],
  "hard_limits":{"maximum_rows":1000,"maximum_bytes":1048576,"maximum_duration_millis":60000,"maximum_pages":10,"maximum_slices":16,"maximum_cost_millionths":1000000,"requests_per_minute":12},
  "maximum_metadata_bytes":1048576,"maximum_metadata_tables":1000,"maximum_metadata_columns":10000,"maximum_schema_entries_per_page":256,"qualification_lifetime_seconds":600
}
